file_name,uni,wylie,url,dept,grade,char_len,audio_len,path,inf
STT_NS0033_0055_413564_to_422474,ཡང་མང་པོ་བེད་སྤྱོད་བཏང་ཤོར་གི་འདུག རྒྱལ་བ། རེད་རེད་རེད། དེ་ད་རེད། ང་ཚོ་བུ་དེ་ཚོ་ཡིན་ན་བྷ་ཋིན་གང་ད་ཕར་ཞོག་དེ། ག་རེ་ཟ། འདི་ཕོར་བ་གང་ཟི་ཡོད་ན་མ་འདང་བ་གེ་ཡོད་མ་རེད། ཧེ་ཧེ།  ,yang mang po bed spyod btang shor gi 'dug_rgyal ba/_red red red/_de da red/_nga tsho bu de tsho yin na b+ha Thin gang da phar zhog de/_ga re za/_'di phor ba gang zi yod na ma 'dang ba ge yod ma red/_he he/__,https://d38pmlk0v88drf.cloudfront.net/wav16k/STT_NS0033_0055_413564_to_422474.wav,STT_NS,3,169,8.91,wav16k/STT_NS0033_0055_413564_to_422474.wav,ལས་ཀང་འཕྲོད་དུས་ནི་ཡང་མང་པོ་ཅིག་བེད་སྤྱོད་བཏང་ཤོར་གི་འདུག རྒྱ་གར་་། རེད་རེདེད། དེ་ད་རེད། ང་ཚོ་བུ་དེ་ཚོ་ཡིན་ན་ད་བྷ་ཌིན་གང་ད་ཕར་བཞག དེ་ད་ག་རེ་ཟ་དེ་ཕུར་པ་གང་སི་ཡོད་ན་མ་འདང་ཡ་གེ་ཡོད་མ་རེད།
STT_NS0033_0056_422474_to_431384,ཨོ་དེ་ཆུ་བཞུ་ཟི་བྱས་ནས་འགྲོ་བཞག་གི་ཡོད་རེད། ཨུན། བུ་མོ་དེ་ཚོ་ཡིན་ན་བྷ་ཋིན་གཅིག་འདང་གི་མི་འདུག་བ་ད། ཨུན། སྐྲ་ཁོ་རང་ལ་བྷ་ཋིན་གཅིག་གི་ཆུ་མར་རྫོགས་ཡ་རེད་ཤག ཨེ་ནས་ཡང་བསྐྱར་འགོ་ནསགཟུགས་པོ་གང་ཚང་ལ་ཅིག་གཡོག་དགོས་རེད། དངོས་གནས་ ,o de chu bzhu zi byas nas 'gro bzhag gi yod red/_un/_bu mo de tsho yin na b+ha Thin gcig 'dang gi mi 'dug ba da/_un/_skra kho rang la b+ha Thin gcig gi chu mar rdzogs ya red shag_e nas yang bskyar 'go nasagazugs po gang tshang la cig g.yog dgos red/_dngos gnas _,https://d38pmlk0v88drf.cloudfront.net/wav16k/STT_NS0033_0056_422474_to_431384.wav,STT_NS,3,219,8.91,wav16k/STT_NS0033_0056_422474_to_431384.wav,གདོང་དེ་ཆུ་བཞུ་ཙི་བྱས་ནས་འགྲོ་བཞག་གོ་རེད། ཨུན། བུ་མོ་སྡེ་ཚོན་ཡིན་ན་བར་སཀྲིན་གཅིག་འདང་གི་མི་འདུག་བ་ད། ཨུན། སྐྲ་ཁོ་རང་ལ་བར་སྲིན་གཅིག་གིས་ཆུ་མ་འཛིལ་བ་རེད་ཤག དེ་ནས་ཡང་བསྐྱར་འགོ་ནས་གཟུགས་པོ་གང་ཚང་ལ་ཅིག་གཡོག་དགོས་རེད། དངོས་གནས་
STT_NS0033_0057_431789_to_436902,ཞེ་བོ་རེད་འདུག་བ། དེ་ད་བུ་དང་བུ་མོ་ལ་ཏོག་ཙི་ཁྱད་པར་འདྲ་བོ་ཡོད་རྒྱོ་འདྲ་བོ་མཐོང་སོང་ད། ཨ་མ་མ། ཁྱད་པར་ད་དཔེ་རེད། ཨུན། དམིགས་བསལ་གིས་ཆུའི་སྒང་ལ་ད་ ,zhe bo red 'dug ba/_de da bu dang bu mo la tog tsi khyad par 'dra bo yod rgyo 'dra bo mthong song da/_a ma ma/_khyad par da dpe red/_un/_dmigs bsal gis chu'i sgang la da _,https://d38pmlk0v88drf.cloudfront.net/wav16k/STT_NS0033_0057_431789_to_436902.wav,STT_NS,3,144,5.113,wav16k/STT_NS0033_0057_431789_to_436902.wav,ཞེ་བོ་རེད་འདུག་བ། དེ་ད་བུ་དང་བུ་མོ་ལ་ཏོག་ཙི་ཁྱད་པར་འདྲ་བོ་ཡོད་རྒྱོ་འདྲ་བོ་ཅིག་མཐོང་གི་འདུག་ད། དངོས་གནས། ཁྱད་པར་ད་དཔེ་རེད། དམིགས་བསལ་གི་ཆུ་སྒང་ལ་ད་ྟ་
STT_NS0033_0104_840400_to_849900,དེ་རིང་ད་ང་གཉིས་རྒྱལ་བ། དེ་འདྲ་དེ་འདྲ་མཐོང་སོང་། ང་ཚོ་ཡིན་ནས་པར་དེ་མཐོང་གོ་རེད་བ། པར་དེ་མཐོང་དུས་ཚོར་བ་ཤུགས་ཆེན་པོ་ཞིག་སླེབས། སོ་སོ་གིས་འགྱིག་དམ་གཅིག་མ་ཤས་མེད་ན། ཡིབ་ཟི་ཡིབ་ཟི་དེ་འདྲས་བཏུང་རེད་བ་ད་བཞག་བསྡད། ཨེ་ནས་ཡང་ ,de ring da nga gnyis rgyal ba/_de 'dra de 'dra mthong song /_nga tsho yin nas par de mthong go red ba/_par de mthong dus tshor ba shugs chen po zhig slebs/_so so gis 'gyig dam gcig ma shas med na/_yib zi yib zi de 'dras btung red ba da bzhag bsdad/_e nas yang _,https://d38pmlk0v88drf.cloudfront.net/wav16k/STT_NS0033_0104_840400_to_849900.wav,STT_NS,3,217,9.5,wav16k/STT_NS0033_0104_840400_to_849900.wav,དེ་རིང་ད་ང་གཉིས་རྒྱ་བར་དེ་འདྲའི་དེ་འདྲའ་མཐོང་སོང་། ང་ཚོ་ཡིན་ནས་པར་དེ་མཐོང་གི་ཡོད་རེད། པར་དེ་མཐོང་དུས་ཚོར་བ་ཤུགས་ཆེན་པོ་ཅིག་སླེབས། སོ་སོ་གི་འགྱིག་དམ་གཅིག་མ་ཤས་མེད་ནས། བཡིབས་སུ་ཡིབས་སུ་དེ་འདྲའི་འཐུང་རེད་བ།  ད་བཞག་དེ། དངོས་གནས་ཡང་
STT_NS0033_0105_849900_to_859401,དེ་ཚོགས་ཁང་དེ་ནས་གྲོལ། ཡང་མིན་ན་པར་དེ་མཐོང་ཨེ་ནས་ཆུ་ཚོད་ཁ་ཤས་ཅིག་རན་ཚར་དུས་ཡང་དྲན་པ་བརྗེད་འགྲོ་གི་འདུག་བ་ད། ཨུན་བརྗེད་འགྲོ་གི། ད་དེ་མིན་པའི་ཐོག་ནས་ང་རང་ཚོས་ཉིན་རེ་ཉིན་རེར་སྐུལ་མ་བྱེད་དགོས་པ་གལ་ཆེན་པོ་རེད་འདུག་བ། ཨུན།  ,de tshogs khang de nas grol/_yang min na par de mthong e nas chu tshod kha shas cig ran tshar dus yang dran pa brjed 'gro gi 'dug ba da/_un brjed 'gro gi/_da de min pa'i thog nas nga rang tshos nyin re nyin rer skul ma byed dgos pa gal chen po red 'dug ba/_un/__,https://d38pmlk0v88drf.cloudfront.net/wav16k/STT_NS0033_0105_849900_to_859401.wav,STT_NS,3,218,9.501,wav16k/STT_NS0033_0105_849900_to_859401.wav,དེ་ཚོག་ཁང་དེ་ནས་གྲོལ། ཡང་མིན་ན་དེ་པར་དེ་མཐོང་། ཨེ་ནས་ཆུ་ཚོད་ཁ་ཤས་ཅིག་རེལ་ཚར་དུས་ཡང་དྲན་པ་བརྗེད་འགྲོ་གི་འདུག་བ་ད། ཨུནརེད་རེད་། ད་དེ་མིན་པའི་ཐོག་ནས་ད་ང་རང་ཚོ་ཉིན་རེ་ཉིན་རེ་རྐུལ་མ་བྱེད་དགོས་ཡ་ད་གལ་ཆེན་པོ་རེད་འདུག་བ་ད། ཨུན་བྱས་ཙང་།
STT_NS0033_0106_863249_to_872198,ཨེ་ནས་ག་རེ་ལབ་དགོས་རེད། ད་དམིགས་བསལ་ག་རེ་ལབ་དགོས་རེད། ཁ་ཤས་ཀིས་ཁ་ལག་ལ་ཁ་ལག་བཟོ་དུས་སྐབས་སུ་ད་ཆུ་དེ་བེད་སྤྱོད་བྱེད་སྟངས་ཅིག་ཡོད་རེད་བ། ཨུན། ད་དེ་དུས་ངས་ཚད་ལས་བརྒལ་བའི་ག་རེ་ལབ་དགོས་རེད། ཏོག་ཙི་ཅིག ,e nas ga re lab dgos red/_da dmigs bsal ga re lab dgos red/_kha shas kis kha lag la kha lag bzo dus skabs su da chu de bed spyod byed stangs cig yod red ba/_un/_da de dus ngas tshad las brgal ba'i ga re lab dgos red/_tog tsi cig_,https://d38pmlk0v88drf.cloudfront.net/wav16k/STT_NS0033_0106_863249_to_872198.wav,STT_NS,3,195,8.949,wav16k/STT_NS0033_0106_863249_to_872198.wav,ཨེ་ནས་ག་རེ་ལབ་དགོས་རེད་ད་ཨུན་དམིགས་བསལ་ག་རེ་ལབ་དགོས་རེད། ཁ་ཤས་ཀིས་ཁ་ལག་ལ་ཁ་ལག་བཟོ་དུས་སྐབས་སུ་ད་ཆུ་དེ་བེད་སྤྱོད་བྱེད་སྟངས་ཅིག་ཡོད་རེད་བ་ད། ཨུན། དེ་དུས་ངས་ཚད་ལས་བརྒལ་བའི་ག་རེ་ལབ་དགོས་རེད་ ཏོག་ཙི་ཅིག
STT_NS0033_0107_872198_to_881147,ཞན་པོ་འདྲ་བོ་མཐོང་གི་འདུག དམིགས་བསལ་གིས་ད་ང་ཚོ་ད་ལྟ་ཐབ་ཚང་ང་རང་ཚོ་གི་སྤྱི་ཐབ་ལ་ལྟ་བ་ཡིན་ན། ཨུན། བུ་གུ་ཚང་མས་ཁ་ལག་ཟ་ས་གི་ས་ཆ་ཆགས་བསྡད་ཡོད་རེད། འདི་ལ་ད་ང་ཚོ་གིས་ཆུ་བེད་སྤྱོད་བྱེད་སྟངས་ཅིག་འདུག་བ། ཨུན། ཁ་ལག་ལ ,zhan po 'dra bo mthong gi 'dug_dmigs bsal gis da nga tsho da lta thab tshang nga rang tsho gi spyi thab la lta ba yin na/_un/_bu gu tshang mas kha lag za sa gi sa cha chags bsdad yod red/_'di la da nga tsho gis chu bed spyod byed stangs cig 'dug ba/_un/_kha lag la_,https://d38pmlk0v88drf.cloudfront.net/wav16k/STT_NS0033_0107_872198_to_881147.wav,STT_NS,3,206,8.949,wav16k/STT_NS0033_0107_872198_to_881147.wav,ཞན་པོ་འདྲ་བོ་མཐོང་གི་འདུག དམིགས་བསལ་གི་ད་ང་ཚོ་ད་ལྟ་ཐབ་ཚང་ང་རང་ཚོ་གི་སྤྱི་ཐབས་ལ་ལྟ་བ་ཡིན་ན། ཨུན། བུ་གུ་ཚང་མ་ཁ་ལག་ཟ་ས་གི་ས་ཆ་ཆགས་བསྡད་ཡོད་རེད། འདི་ལ་ད་ང་ཚོ་གིས་ཆུ་བེད་སྤྱོད་བྱེད་སྟངས་ཅིག་འདུག་བ། ཨུནཁ་ལག
STT_NS0033_0128_1042832_to_1046579,གནས་རྩ་ཆེན་པོ་དེ་རེད་དེ། ཡིན་ན་ཡང་དེའི་ནང་ལོགས་ལ་ག་རེ་བྱེད་ཀི་ཡོད་རེད་མི་དེ་ཚོ་གིས་རྦད་དེ།  ,gnas rtsa chen po de red de/_yin na yang de'i nang logs la ga re byed ki yod red mi de tsho gis rbad de/__,https://d38pmlk0v88drf.cloudfront.net/wav16k/STT_NS0033_0128_1042832_to_1046579.wav,STT_NS,3,92,3.747,wav16k/STT_NS0033_0128_1042832_to_1046579.wav,གནས་རྩ་ཆེན་པོ་དེ་རེད་དེ། ཡིན་ན་ཡང་དེའི་ནང་ལོགས་ལ་ག་རེ་བྱེད་དགོས་རེད། མི་དེ་ཚོ་གིས་རྦད་དེ།
STT_NS0033_0129_1047220_to_1052645,ཆུ་ནང་ལ་གད་སྙིགས་རྐྱང་རྐྱང་གཡུག མི་རོ་གཡུག་དེ་འདྲས་བྱས་རེད་བ་ད་དེང་སང་ཛོར་པོ་ཞེ་བོ་ཆགས་ཚར་རེད་བ་ད། ཨུན།  ,chu nang la gad snyigs rkyang rkyang g.yug_mi ro g.yug de 'dras byas red ba da deng sang dzor po zhe bo chags tshar red ba da/_un/__,https://d38pmlk0v88drf.cloudfront.net/wav16k/STT_NS0033_0129_1047220_to_1052645.wav,STT_NS,3,105,5.425,wav16k/STT_NS0033_0129_1047220_to_1052645.wav,ཆུ་ནང་ལོགས་གད་སྙིགས་རྐྱང་རྐྱང་གཡུགས། མི་རོ་གཡུགས་དེ་འདྲའི་བྱས་རེད། ད་དེང་སང་ཛོར་པོ་ཞེ་བོ་ཆགས་ཚར་རེད་བ་ད། ཨུན
STT_NS0033_0130_1052645_to_1058070,བྱས་ཙང་ལབ་ཡིན་ཨུན། བོད་ལ་ཡིན་ན་ད་དངོས་གནས་ཆུ་དངོས་གནས་ད་གཅིག་ད་ས་ཆ་རེད་བ། ཨུན། ང་ཚོའི་ས་ཆ་ལ་ཕར་བོད་ལ་ཡིན་ན།  ,byas tsang lab yin un/_bod la yin na da dngos gnas chu dngos gnas da gcig da sa cha red ba/_un/_nga tsho'i sa cha la phar bod la yin na/__,https://d38pmlk0v88drf.cloudfront.net/wav16k/STT_NS0033_0130_1052645_to_1058070.wav,STT_NS,3,109,5.425,wav16k/STT_NS0033_0130_1052645_to_1058070.wav,བྱས་ཙང་ལབ་ཡིན་ཨོ། བོད་ལ་ཡིན་ན་ད་དངོས་གནས་ཆུ་དངོས་གནས་ད་གཅིག་ད་ས་ཆ་རེད་བ། ། ང་ཚོབོད་ས་ཆ་ལ་ཕར་བོད་ལ་ཡིན་ན།
STT_NS0033_0131_1060079_to_1062863,ཉིན་གུང་ཉུང་བ་བྱས་ཏོག་ཙི་མང་ཆེ་བ་གངས་ཆུ་དང་།  ,nyin gung nyung ba byas tog tsi mang che ba gangs chu dang /__,https://d38pmlk0v88drf.cloudfront.net/wav16k/STT_NS0033_0131_1060079_to_1062863.wav,STT_NS,3,46,2.784,wav16k/STT_NS0033_0131_1060079_to_1062863.wav,ཉིན་གུང་ཉུང་བ་བྱས་ཏོག་ཙི་མང་ཆེ་གང་ཆུ་དང་།
STT_NS0033_0132_1062947_to_1069335,ཨུན་ཨེ་འདྲས་རྒྱུག་སླེབས་ཀི་ཡོད་རེད་བ། ཨོ་དེ་ཆུ་དེ་ཚོ་དཔེ་ད་ག་རེ་བཏུང་ན་ལས་དཔེ་ཞིམ་པོ་འདུག་བ་རེད་བ། ཨུན། བཏུང་ན་ཞིམ་པོ་དེ་ནས་ད་ད་ལྟ་ཀ་ཅི་ང་ཚོ་གི་ ,un e 'dras rgyug slebs ki yod red ba/_o de chu de tsho dpe da ga re btung na las dpe zhim po 'dug ba red ba/_un/_btung na zhim po de nas da da lta ka ci nga tsho gi _,https://d38pmlk0v88drf.cloudfront.net/wav16k/STT_NS0033_0132_1062947_to_1069335.wav,STT_NS,3,145,6.388,wav16k/STT_NS0033_0132_1062947_to_1069335.wav,ཨེ་འདྲའི་རྒྱུར་སླེབས་ཡོད་རེདབ། འོ་དེ་ཆུ་དེ་ཚོ་དཔེ་ད་ག་རེ་བཏུང་ན་ལས་དཔེ་ཞིམ་པོ་འདུག་བ། རེད་བ། ུན། བཏུང་ནས་ཞིམ་པོ ད་ལྟ་དེ་ང་ཚོ་གི་
STT_NS0033_0133_1069335_to_1075722,ཆུ་གཙང་མ་བཟོ་ཡ་དེ་དང་ང་ཚོ་བོད་ལ་ཆུ་གཙང་མ་མ་བཟོས་ཁ་ཐུག་འཐུང་བ་ཡིན་ན། བོད་ཀི་རྦད་དེ་ཞིམ་པ་ཡོད་རྒྱོ་འདྲ་བོ་ཡོད་བ། ཨེ་འདྲའི་འདྲ་བོ་ཚོར་སོང་ད་རེད་བ། ཨུན།  ,chu gtsang ma bzo ya de dang nga tsho bod la chu gtsang ma ma bzos kha thug 'thung ba yin na/_bod ki rbad de zhim pa yod rgyo 'dra bo yod ba/_e 'dra'i 'dra bo tshor song da red ba/_un/__,https://d38pmlk0v88drf.cloudfront.net/wav16k/STT_NS0033_0133_1069335_to_1075722.wav,STT_NS,3,150,6.387,wav16k/STT_NS0033_0133_1069335_to_1075722.wav,ཆུ་གཙང་མ་བཟོ་ཡ་དེ་དང་ང་ཚོ་བོད་ལ་ཆུ་གཙང་མ་མ་བཟོས། ཁོ་ད་ལྟ་ཁ་ཐུག་བཐུང་ག་བསྡདབ་ན་ བོད་ཀྱི་རྦད་དེ་ཞིམ་པོ་ཡོད་རྒྱོ་འདྲ་བོ་ཡོད་བ། ཨེ་འདྲའི་འདྲ་བོ་བྱས་སོད་ད་རེད་བ།
STT_NS0033_0134_1077865_to_1081020,ཨུན་ད་ཁྱོད་རང་ཨེ་འདྲའི་མཐོང་མྱོང་ཡོད་བེ། ང་སྔོན་མ་བལ་ཡུལ་ལ་ཅིག་འགྲོ་ཡིན་པ།  ,un da khyod rang e 'dra'i mthong myong yod be/_nga sngon ma bal yul la cig 'gro yin pa/__,https://d38pmlk0v88drf.cloudfront.net/wav16k/STT_NS0033_0134_1077865_to_1081020.wav,STT_NS,3,76,3.155,wav16k/STT_NS0033_0134_1077865_to_1081020.wav,ཨད་ཁྱེད་རང་ཨེ་འདྲའི་མཐོང་མྱོང་ཡོདབ། ང་སྔོན་མ་བལ་ཡུལ་ལ་གཅིག་འགྲོ་ཡིན་པ།
STT_NS0033_0135_1081729_to_1090137,ད་ལྟ་ང་རང་ཚོ་ད་སློབ་གྲྭ་ལ་ཡིན་ན། ཆུ་ཚང་མ་དེ་ང་ཚོ་ད་ཆུ་གཙང་མ་བཟོ་ཡ་གི་འཕྲུལ་ཆས་ཡོད་རེད་བ། ཨུན། ད་ལྟ་ཧྥིལ་ཋེར་ཝཱ་ཋྀར་ལབ་ཀི་རཱ། ཨུན། ཨོ་དེ་ད་ ,da lta nga rang tsho da slob grwa la yin na/_chu tshang ma de nga tsho da chu gtsang ma bzo ya gi 'phrul chas yod red ba/_un/_da lta h+phil Ther wA Th-ir lab ki rA/_un/_o de da _,https://d38pmlk0v88drf.cloudfront.net/wav16k/STT_NS0033_0135_1081729_to_1090137.wav,STT_NS,3,139,8.408,wav16k/STT_NS0033_0135_1081729_to_1090137.wav,ད་ལྟ་ང་རང་ཚོ་ྟསློབ་གྲྭ་ལ་ཡིན་ན་ཆུ་ཚང་མ་དེ་ང་ཚོ་ད་ཆུ་གཙང་མ་བཟོ་ཡ་གི་འཕྲུལ་ཆས་ཡོད་རེད་བ། ཨུན། ད་ལྟ་ཧྥི་རོ་ཝོ་ཌྀ་ལབ་ཀི་རེད་བ། ུའོ་དེ་
STT_NS0033_0136_1090137_to_1098545,གཙང་ཆུ། གཙང་ཆུ་ད་སྡོད་ཁང་ནང་འདུག་བ། ཨུན། ཨོ་དེ་ཏོག་ཙི་ལམ་སང་ཡང་སོ་སོ་རྫོགས་པ་དང་ལམ་སང་ལེན་ཆོག་ཆོག་འདྲ་བོ་འདུག་བ། ཕར་བལ་ཡུལ་ལ་ནི་ཆུ་ཚང་མ་ ,gtsang chu/_gtsang chu da sdod khang nang 'dug ba/_un/_o de tog tsi lam sang yang so so rdzogs pa dang lam sang len chog chog 'dra bo 'dug ba/_phar bal yul la ni chu tshang ma _,https://d38pmlk0v88drf.cloudfront.net/wav16k/STT_NS0033_0136_1090137_to_1098545.wav,STT_NS,3,137,8.408,wav16k/STT_NS0033_0136_1090137_to_1098545.wav,་ཚོ་གཙང་ཆུ་དསྡོད་ཁང་ནས་འདུག་བ། ུ། འོ་དེ་ཏོག་ཙི་ལམ་སང་སོ་སོ་རྫོགས་པ་དང་ལམ་སང་ལེན་ཆོག་ཆོག་འདྲ་བོ་འདུག་བ། ུ། ཕར་བལ་ཡུལ་སླེབ་ན་ཆུ་ཚང་མ་ཐ་
STT_NS0033_0137_1098545_to_1106953,ཐག་རིང་པོ་ནས་དབོར་ནས་སླེབས་ཀི་འདུག་བ། ཨུན་ཨུན། ང་ཚོ་དམིགས་བསལ་གིས་ཆུ་བཏུང་ཡ་དེ་ཚོ་ཉོ་དགོས་འདུག་བ། ཨུན། ཨ་མ་རྟག་པར་ཨེ་འདྲས་ཉོ་བཞག་ན་ཆུ་ག་ཚོད་འགྲོ་སོང་འགྲོ་གི་རེད་རེད་བ། རེད་རེད་དངོས་གནས་རེད། སྤྱིར་བཏང་ད་ད་ལྟ་བལ་ཡུལ་ ,thag ring po nas dbor nas slebs ki 'dug ba/_un un/_nga tsho dmigs bsal gis chu btung ya de tsho nyo dgos 'dug ba/_un/_a ma rtag par e 'dras nyo bzhag na chu ga tshod 'gro song 'gro gi red red ba/_red red dngos gnas red/_spyir btang da da lta bal yul _,https://d38pmlk0v88drf.cloudfront.net/wav16k/STT_NS0033_0137_1098545_to_1106953.wav,STT_NS,3,215,8.408,wav16k/STT_NS0033_0137_1098545_to_1106953.wav,རིང་པོ་དབོར་ནས་སླེབས་ཀི་འདུག་བ། ། ཞུ་ང་ཚོ་དམིགས་བསལ་གི་ཆུ་འཐུང་ཡ་དེ་ཚོ།ཉོ་དགོས་འདུག་བ། ཨུན་ཧུན། ཨ་མ་རྟག་པར་ཨེ་འདྲའི་ཉོ་བཞོག་ན་ཆུ་ག་ཚོད་འགྲོ་སོང་འགྲོ་རེད་རེད་། རེད་རེད་དངོས་གནས་རེད། སྤྱིར་བཏང་ད་ད་ད་
STT_NS0033_0164_1331290_to_1340855,དང་པོ་སོ་སོའི་ངོས་ནས་འགོ་རྩོམ་དགོས་རེད་བ་ད། ཨུན། མི་ལབ་ཡ་དེ་མི་ལ་ཕར་ལབ་ཡ་ད་དང་པོ་སོ་སོའི་ངོས་ནས་ཅིག་ཡག་པོ་བྱེད་ཤེས་པ་འདྲ་བོ་ཅིག་ད་དགོས་འདུག་བ་ད། ཨུན། ཨེ་འདྲའི་འདྲ་བོ་ཡོད་དུས་ད་མཚམས་རེ་སོ་སོ་ག་རེ་ལབ་དགོས་རེད། སྡོད་ཁང་རྒན་བདག་ཡིན་ན་ ,dang po so so'i ngos nas 'go rtsom dgos red ba da/_un/_mi lab ya de mi la phar lab ya da dang po so so'i ngos nas cig yag po byed shes pa 'dra bo cig da dgos 'dug ba da/_un/_e 'dra'i 'dra bo yod dus da mtshams re so so ga re lab dgos red/_sdod khang rgan bdag yin na _,https://d38pmlk0v88drf.cloudfront.net/wav16k/STT_NS0033_0164_1331290_to_1340855.wav,STT_NS,3,231,9.565,wav16k/STT_NS0033_0164_1331290_to_1340855.wav,དང་པོ་སོ་སོའི་ངོས་ནས་འགོ་བརྩོམ་གི་རེད་ཟ། ཨུན། མི་ལབ་ཡ་དེ་མི་ཕར་ལབ་ཡ་དང་དང་པོ་སོ་སོའི་ངོས་ནས་ཅིག་ཡག་པོ་བྱེད་ཤེས་པ་འདྲ་བོ་ཅིག་ད་དགོས་འདུག་བ་ད། ཨུན། ཨེ་འདྲའི་འདྲ་བོ་ཡོད་དུས་ད་མཚམས་རེ་སོ་སོ་སོ་སོ་ག་རེ་ལབ་དགོས་རེད། སྡོད་ཁང་རྒན་བདག་ཡིན་ན།
STT_NS0033_0165_1340855_to_1350420,ཡང་མིན་ན་སོ་སོས་དང་དུ་བླངས་ནས་ད་དེ་རིང་ང་ཚོ་ཆུ་གི་འགྲོ་སྟངས་དེ་དེ་འདྲ་ཅིག་ཡིན་འདྲ་བོ་ཡོད་བ། ཨུན། ད་དཔེ་ཆ་བཞག་ན་ཁྱེད་རང་སྡོད་ཁང་ནང་ལོགས་ལ་གསང་སྤྱོད་ཁྲུས་ཁང་ནང་ལོགས་ལ་ཆུ་བེད་སྤྱོད་གཏོང་སྟངས་དེ་འདྲ་དེ་འདྲ་གཏོང་རོགས་བྱས་ཟེར།  ,yang min na so sos dang du blangs nas da de ring nga tsho chu gi 'gro stangs de de 'dra cig yin 'dra bo yod ba/_un/_da dpe cha bzhag na khyed rang sdod khang nang logs la gsang spyod khrus khang nang logs la chu bed spyod gtong stangs de 'dra de 'dra gtong rogs byas zer/__,https://d38pmlk0v88drf.cloudfront.net/wav16k/STT_NS0033_0165_1340855_to_1350420.wav,STT_NS,3,222,9.565,wav16k/STT_NS0033_0165_1340855_to_1350420.wav,ཡང་མིན་ན་སོ་སོ་དང་དུ་ལངས་ནས་ད་དེ་རིང་ང་ཚོ་ཆུའི་འགྲོ་སྟངས་དེ་དེ་འདྲི་ཅིག་ཡིན་འདྲ་བོ་ཡོད་བ། ཨུ། དཔེ་ཆ་བཞག་ན་ཁྱེད་རང་སྡོད་ཁང་ནང་ལོགས་ལ་གསང་སྤྱོད་འཁྲུས་ཁང་ནང་ལོགས་ལ་ཆུ་བེད་སྤྱོད་གཏང་སྟངས་དེ་ཚོ་དེ་འདྲའ་དེ་འདྲའ་གཏང་རོགས་བྱས་ཟེ།་
