file_name,uni,wylie,url,dept,grade,char_len,audio_len,path,inf
STT_NS0033_0020_146230_to_149959,ཨུམ་ཨུམ། མྱོང་བཅུག་སོང་བེ། སྤྱིར་བཏང་ང་ཚོ་འདི་བ་དེ་ས་ཆ་དེ་ཚོ་ཆུ་དེ་ག་བ་ནས་སླེབས་ཀི་ཡོད་བ་ཁྱོད་རང་ཧ་གོ་གི་ཡོད་བེ།  ,um um/_myong bcug song be/_spyir btang nga tsho 'di ba de sa cha de tsho chu de ga ba nas slebs ki yod ba khyod rang ha go gi yod be/__,https://d38pmlk0v88drf.cloudfront.net/wav16k/STT_NS0033_0020_146230_to_149959.wav,STT_NS,3,114,3.729,wav16k/STT_NS0033_0020_146230_to_149959.wav,ཨུན་། མྱལ་གཅིག་སང་ངེ། སྤྱིར་བཏང་ང་ཚོ་འདི་བ་འདིའི་ས་ཆ་དེ་ཚོ་ཆུ་དེ་ག་བ་ནས་སླེབས་ཀི་ཡོད་ཁྱེད་རང་ཧ་གོ་གི་ཡོད་བེ།
STT_NS0033_0021_150415_to_157106,ཆུ་དེ་ད་ས་འོག་ནས་སླེབས་ཀི་ཡོད་རེད་ལབ་ཀི་འདུག་བ། ཨུན་ཨོ་དེ་ས་འོག་གི་ཆུ་ཡིན་ས་རེད་རེད་བ། ཨོ་ས་འོག་ཆུ་རེད། ང་ཚོ་ནམ་རྒྱུན་དེ་ཧི་མ་ཅལ་དང་རྡ་རམ་ས་གཡས་གཡོན་ ,chu de da sa 'og nas slebs ki yod red lab ki 'dug ba/_un o de sa 'og gi chu yin sa red red ba/_o sa 'og chu red/_nga tsho nam rgyun de hi ma cal dang rda ram sa g.yas g.yon _,https://d38pmlk0v88drf.cloudfront.net/wav16k/STT_NS0033_0021_150415_to_157106.wav,STT_NS,3,150,6.691,wav16k/STT_NS0033_0021_150415_to_157106.wav,ཆུ་དེ་ད་ས་བ་ནས་སླེབས་ཀ་ཡོད་རེད་ལབ་ཀི་འདུག་བ། ཨུ མང་ཆེ་ས་འོག་ཆུ་ཡིན་ས་རེད་ར། ས་ཆུ་། ང་ཚོ་ནམ་རྒྱུན་འདི་ཧི་མ་ཅལ་དང་དེ་ནས་རྡ་རམ་ས་ཡ་
STT_NS0033_0022_157106_to_163797,དེ་ཚོ་ལ་ཡིན་ན་ད་རི་ཆུ་རང་བེད་སྤྱོད་བྱེད་ཀི་འདུག་བ། རེད་རེད་ཨོ། ཆུ་དེ་ཚོ་ཡིན་ན་འབེལ་འབེལ་ལྷུག་ལྷུག་བྱས། འདི་བ་ཡིན་ན་ཏོག་ཙི་དཀའ་ངལ་འདུག་བ། ཨུན་ཨུན། དཀའ་ངལ་འདུག་ད་རེད་བ། ཁོ་རང་ཚོ་གཅིག་གིས་གཅིག་ལ་བསམ་ ,de tsho la yin na da ri chu rang bed spyod byed ki 'dug ba/_red red o/_chu de tsho yin na 'bel 'bel lhug lhug byas/_'di ba yin na tog tsi dka' ngal 'dug ba/_un un/_dka' ngal 'dug da red ba/_kho rang tsho gcig gis gcig la bsam _,https://d38pmlk0v88drf.cloudfront.net/wav16k/STT_NS0033_0022_157106_to_163797.wav,STT_NS,3,197,6.691,wav16k/STT_NS0033_0022_157106_to_163797.wav,དེ་ཚོ་ལ་ཡིན་ན་ད་རི་ཆུ་རང་བེད་སྤྱོད་བྱེད་ཀི་འདུག་བ། ། ཆུ་དེ་ཚོ་ཡིན་ནས་འབལ་ོ་ལྷོད་ལྷོད་བྱས། དེ་བ་ཡིན་ན་ཏིག་ཙི་དཀའ་ངལ་འདུག་བ། དངོས་གནས་ཁོ་རང་ཚོ་གཅིག་དུག་བསམ་དང་རེད།
STT_NS0033_0023_163982_to_171812,མཚམས་རེ་ད་ང་དྲན་གི་འདུག་ད། ང་ཚོའི་སྡོད་ཁང་དང་བུ་མོའི་སྡོད་ཁང་དེ་ཚོ་དཔེ་བཞག་བ་ཡིན་ན། བུ་མོ་དེ་ཚོ་ད་ཆུ་དཀའ་ངལ་གཅིག་ག་འཕྲད་ཀི་ཡོད་ས་མ་རེད་དྲན་གི་འདུག ག་དུས་ཡིན་ནས་ཉི་མ་གཅིག་མ་ཆད་བ་དུགས་སློག་བཀྲུས་མ་ཚར་བ་བསྡད་ཀི་འདུག་བ་ད།  ,mtshams re da nga dran gi 'dug da/_nga tsho'i sdod khang dang bu mo'i sdod khang de tsho dpe bzhag ba yin na/_bu mo de tsho da chu dka' ngal gcig ga 'phrad ki yod sa ma red dran gi 'dug_ga dus yin nas nyi ma gcig ma chad ba dugs slog bkrus ma tshar ba bsdad ki 'dug ba da/__,https://d38pmlk0v88drf.cloudfront.net/wav16k/STT_NS0033_0023_163982_to_171812.wav,STT_NS,3,219,7.83,wav16k/STT_NS0033_0023_163982_to_171812.wav,མཚམས་རེ་ད་ང་དྲན་གི་འདུག་ད། ང་ཚོ་སྡོད་ཁང་དང་བུ་མོའི་སྡོད་ཁང་དེ་ཚོ་དཔེ་བཞག་པ་དང་། བུ་མོ་དེ་ཚོ་ད་ཆུ་དཀའ་ངལ་གཅིག་ཡེ་འཕྲད་ཀི་ཡོད་ས་མ་རེད་དྲན་གི་འདུག ག་དུས་ཡིན་ནས་ཉི་མ་གཅིག་མ་ཆད་པ་དུགས་སློག་བཀྲུས་མ་ཚ་བོ་བསྡད་ཀི་འདུག་བ་ད།
STT_NS0033_0031_220649_to_229124,མཚམས་མཚམས་མི་དེ་ཚོ་ཡང་གཟུགས་པོ་མ་བཀྲུས། དྲེག་པ་བསགས་བསྡད་ན་ཡང་། ཏོག་ཙི་ཡང་ཆུ་ཏོག་ཙི་ཡང་ད་སྲུང་སྐྱོབ་བྱེད་ཡ་དང་། ཆུ་གྲོན་ཆུང་ལ་ཏོག་ཙི་ཡང་ཕན་ཐོགས་ཡོད་རྒྱོ་འདྲ་བོ་འདུག་ད། ང་ཚོ་བུ་མོ་ ,mtshams mtshams mi de tsho yang gzugs po ma bkrus/_dreg pa bsags bsdad na yang /_tog tsi yang chu tog tsi yang da srung skyob byed ya dang /_chu gron chung la tog tsi yang phan thogs yod rgyo 'dra bo 'dug da/_nga tsho bu mo _,https://d38pmlk0v88drf.cloudfront.net/wav16k/STT_NS0033_0031_220649_to_229124.wav,STT_NS,3,180,8.475,wav16k/STT_NS0033_0031_220649_to_229124.wav,མཚམས་མཚམས་བུ་དེ་ཚོ་ཡང་གཟུགས་པོ་མ་བཀྲུས་དྲག་པ་ཟ་བསྡད་ན་ཡང་ཏོག་ཙི་ཡང་ཆུ་ཏོག་ཙི་ད་ག་རེ་སྲུང་སྐྱོབ་བྱེད་ཡ་དང་། ཆུ་སྒྲོན་འཇུག་ལ་ཏོག་ཙི་ཡང་ཕན་ཐོགས་ཡོད་རྒྱོ་འདྲ་བོ་འདུག་ད། ཨུ། ང་ཚོ་བུ་མོ།
STT_NS0033_0032_229124_to_237600,དེ་ཚོ་ཡིན་ན་ཚར་རེད། དཀོན་མཆོག་མཁྱེན། ད་འཁྲུད་དགོས་ཡོད་ན་མེད་ན་འཁྲུད་བསྡད་ཀི་རེད་ད། ཨུན་ཨུན། ང་རང་ཡིན་ན་འཁྲུད་ཡ་དགའ་པོ་ཡོད་ད་ཡ། དམིགས་བསལ་གིས་དུགས་སློག་འཁྲུད་བསྡད་རེད་ད། ཨུན། གཅིག་ཡོད་བ་གོན་ཚར་རེད། ཡང་མ་བཀྲུས་ན་བདེ་པོ་གཅིག ,de tsho yin na tshar red/_dkon mchog mkhyen/_da 'khrud dgos yod na med na 'khrud bsdad ki red da/_un un/_nga rang yin na 'khrud ya dga' po yod da ya/_dmigs bsal gis dugs slog 'khrud bsdad red da/_un/_gcig yod ba gon tshar red/_yang ma bkrus na bde po gcig_,https://d38pmlk0v88drf.cloudfront.net/wav16k/STT_NS0033_0032_229124_to_237600.wav,STT_NS,3,222,8.476,wav16k/STT_NS0033_0032_229124_to_237600.wav,་མོ་དེ་ཚོ་ཡིན་ན་ཚར་རེད། དཀོན་མཆོག་མཁྱེན། ད་ཀྲི་བོ་ཡོད་ན་མེད་ན་བཀྲུས་བསྡད་ཀི་རེད་ད། ཨུ། ང་རང་ཡིན་ནས་བཀྲུས་ཡ་དགའ་བོ་ཡོད་ད་ཡོད་བ། དམིགས་བསལ་གི་དུགས་སློག་བཀྲུས་བསྡད་ི་རེད་ད། ུན། གཅིག་ཡོད་བ་གོན་ཚར་རེད། ཡང་མ་བཀྲུས་ན་བདེ་བོ་ཅིག
STT_NS0033_0024_172268_to_181777,ད་རེད། ཡིན་ནས་བཀྲུས་བསྡད་ཀི་རེད་ད་རེད་བ། ཨུན། ཡིན་ནས་ཆུ་རྫོགས་ན་ལས་པ་ལགས་ཨ་མ་ལགས་རྟག་པར་སྐད་རྒྱག་གི་རེད་ད་ཡོད་བ། སྡོད་ཁང་ལ། ཨུན་ཧུང་། ད་དེ་རིང་ཆུ་མི་འདུག ཆུ་ཏོག་ཙི་གྲོན་ཆུང་བྱོས་ལབ་རེད། གང་ཤེས་དེ་ལས་ཀྱག་ཀྱག་བྱེད་མྱི་འདྲ་བོ་ ,da red/_yin nas bkrus bsdad ki red da red ba/_un/_yin nas chu rdzogs na las pa lags a ma lags rtag par skad rgyag gi red da yod ba/_sdod khang la/_un hung /_da de ring chu mi 'dug_chu tog tsi gron chung byos lab red/_gang shes de las kyag kyag byed myi 'dra bo _,https://d38pmlk0v88drf.cloudfront.net/wav16k/STT_NS0033_0024_172268_to_181777.wav,STT_NS,3,224,9.509,wav16k/STT_NS0033_0024_172268_to_181777.wav,ད་རེད་ ཡིན་ནས་བཀྲུས་བསྡད་ཀི་རེད་དཱ་རད་།། ཡིན་ནས་ཆུ་དེརང་རྫོགས་ན་ལས་ད་པཱ་ལགས་ཨ་མས་རྟག་པར་སྐད་བརྒྱག་གི་ོ་རེད་ད་ཡོད་བ། སྡོད་ཁང་ལ།། ད་དེ་རིང་ཆུ་མི་འདུག ཆུ་ཏོག་ཙི་འགྲས་འཆུང་བྱེད་ཀི་ཡོད་རེད་ལབ་ཀི་རེད། གང་ཤེས་དེ་ལས་ཀྱག་ཀྱག་བྱེད་མྱི་འདྲ་བོ།
STT_NS0033_0025_181777_to_191286,ད་རུང་གཟུགས་པོ་བཀྲུས་བསྡད་འདུག ཆུ་ཆད་ན་ལས། ཨ་། ཆུ་ད་ཏོག་ཙི་ལྷག་རྒྱོ་ཨེ་འདྲའི་ཡོད་རེད་བ། ཋཱནཁྀ། ད་དངོས་གནས་ད་གིན་ཁྱོད་རང་གིས་ལབ་རྒྱོ་རང་རེད་ད། བོང་གུའི་ཨམ་ཅོག་ནང་གསེར་བླུགས་ན་ཏིང་ལིང་ཏིང་ལིང་། ཧེ་ཧེ་ ,da rung gzugs po bkrus bsdad 'dug_chu chad na las/_a /_chu da tog tsi lhag rgyo e 'dra'i yod red ba/_ThAnakh-i/_da dngos gnas da gin khyod rang gis lab rgyo rang red da/_bong gu'i am cog nang gser blugs na ting ling ting ling /_he he _,https://d38pmlk0v88drf.cloudfront.net/wav16k/STT_NS0033_0025_181777_to_191286.wav,STT_NS,3,199,9.509,wav16k/STT_NS0033_0025_181777_to_191286.wav,ད་རོང་གཟུགས་པོ་བཀྲུས་བསྡད་ཡ་དུ ཆུ་བྱས་ནས་ལས། ཆུ་དག་ར་ཏོག་ཙི་ལྷག་རྒྱོ་དེ་འདྲའ་ཡོད་རེད། ྤྲི་ེ། ད་དངོས་གནས་ད་གིན་ཁྱེད་རང་གིས་ལབ་རྒྱོ་རང་རེད་ད། བོམ་པོ་ཨམ་ཆོག་ནང་གསར་བླུགས་ནས་ཏོ་མ་ཏོང་ལ། ཧ
STT_NS0033_0026_191674_to_195522,འགུལ་ཀྱོག་ཟི་མ་བསླངས་ན་དེ་འདྲའི་འདྲ་བོ་རེད་བ། རེད། མཚམས་རེ་ད་དངོས་གནས་དྲན་གི་འདུག བུ་མོའི་སྡོད་ཁང་ནང་ཆུ་རྫོགས་ཡ་ཁྱོན་ནས་མེད་རྒྱོ།  ,'gul kyog zi ma bslangs na de 'dra'i 'dra bo red ba/_red/_mtshams re da dngos gnas dran gi 'dug_bu mo'i sdod khang nang chu rdzogs ya khyon nas med rgyo/__,https://d38pmlk0v88drf.cloudfront.net/wav16k/STT_NS0033_0026_191674_to_195522.wav,STT_NS,3,131,3.848,wav16k/STT_NS0033_0026_191674_to_195522.wav,དགུག་སྐྱོད་སི་མ་བསླངས་ན་དེ་འདྲའི་འདྲ་བོ་རེད་། རེད་རེད། མཚམས་རེ་ད་དངོས་གནས་དྲན་གི་འདུག བུ་མོའི་སྡོད་ཁང་ནང་ལ་ཆུ་རྫོགས་ཡ་ཁྱོན་ནས་མེད་རྒྱོ།
STT_NS0033_0027_195690_to_202874,ང་ཚོ་བུ་དེ་ཚོ་ཡིན་ན་དངོས་གནས་ཆུ་ལ་ད་རིན་ཐང་སྤྲད། ཆུ་དེ་ཉར་ཚགས་བྱེད་ཀི་ཡོད་ན་ཧ་གོ་མ་སོང་། མཚམས་རེར་གཟུགས་པོ་ཡང་བཀྲུ་གི་ཡོད་མ་རེད། ད་དེ་འདྲ་དེ་འདྲ་གཟུགས་པོ་མ་བཀྲུས། ཧེ་ཧེ། དྲེག་པ་ ,nga tsho bu de tsho yin na dngos gnas chu la da rin thang sprad/_chu de nyar tshags byed ki yod na ha go ma song /_mtshams rer gzugs po yang bkru gi yod ma red/_da de 'dra de 'dra gzugs po ma bkrus/_he he/_dreg pa _,https://d38pmlk0v88drf.cloudfront.net/wav16k/STT_NS0033_0027_195690_to_202874.wav,STT_NS,3,178,7.184,wav16k/STT_NS0033_0027_195690_to_202874.wav,ང་ཚོ་བུད་དེ་ཚོ་ཡིན་ན་དངོས་གནས་ཆུ་ལ་ད་རིན་ཐང་སྤྲད། ཆུ་དེ་ཉར་ཚགས་བྱེད་ཀི་ཡོད་ན་ཧ་གོ་མ་སོང་། མཚམས་རེ་གཟུགས་པོ་ཡང་བཀྲུ་གི་ཡོད་མ་རེད་ད།  བདེནའགྲ་བདེན་དྲྭ་གཟུགས་པོ་མ་བཀྲུས། གྲྭ་བ་
STT_NS0033_0038_281162_to_288689,ད་དུང་དེའི་སྒང་ལ་ཐོལ་པ་དེ་འདྲའི་འདྲ་བོ་འགྲོ། དེ་ཚོ་དངོས་གནས་བེད་མེད་ལོངས་སྤྱོད་རང་རེད་བ། རེད་རེད། དེ་ཚོ་དངོས་གནས་བསམ་བློ་གཏང་ཡ་འདྲ་ཆགས་བསྡད་བཞག་རེད་བ། ཨུན་ཨུན། ད་སྤྱིར་བཏང་ད་ང་ཚོ་ག་རེ་ཡིན་ན་ ,da dung de'i sgang la thol pa de 'dra'i 'dra bo 'gro/_de tsho dngos gnas bed med longs spyod rang red ba/_red red/_de tsho dngos gnas bsam blo gtang ya 'dra chags bsdad bzhag red ba/_un un/_da spyir btang da nga tsho ga re yin na _,https://d38pmlk0v88drf.cloudfront.net/wav16k/STT_NS0033_0038_281162_to_288689.wav,STT_NS,3,191,7.527,wav16k/STT_NS0033_0038_281162_to_288689.wav,ད་དུང་དེའི་སྒང་ཐོལ་བ་དེ་འདྲའི་འགྲོ་ཡ་དེ་ཚོ་དངོས་གནས་བུད་མེད་ལོངས་སྤྱོད་རང་རེད་བ། རེད་རེད། དེ་ཚོ་དངོས་གནས་བསམ་བློ་གཏང་ཡ་འདྲ་བོ་ཆགས་བསྡད་ཤག་རེད་བ། ཨུན་ཨིན། ད་སྤྱིར་བཏང་ང་ཚོ་ག་རེ་ཡིན་ན་
STT_NS0033_0039_288689_to_296215,ད་ཆུ་ལ་མ་རྟེན་མྱི་ད་སུ་གང་གཅིག་ཡོད་མ་རེད་བ། ད་ཟས་ཅིག་བཟོས་བ་ཡིན་ན་ཆུ་ཞེ་བོ་རྟེན་དགོས་འདུག་བ། རེད་རེད། དམིགས་བསལ་ཞོགས་ཇ་དེ་ཚོ་ལ་ཆུ་མ་རག་ན་ད་ག་འདྲའི་དཀའ་ངལ་མྱོང་གི་མ་རེད་ཨ། ཧི་ཧི།  ,da chu la ma rten myi da su gang gcig yod ma red ba/_da zas cig bzos ba yin na chu zhe bo rten dgos 'dug ba/_red red/_dmigs bsal zhogs ja de tsho la chu ma rag na da ga 'dra'i dka' ngal myong gi ma red a/_hi hi/__,https://d38pmlk0v88drf.cloudfront.net/wav16k/STT_NS0033_0039_288689_to_296215.wav,STT_NS,3,179,7.526,wav16k/STT_NS0033_0039_288689_to_296215.wav,ད་ཆུ་ལ་མ་བརྟེན་མྱི་དེ་སུ་གང་ཅིག་ཡོད་མ་རེད་བ། ད་ཟས་ཅིག་བཟོས་དགོས་ཡོན་ན་ཆུ་ལ་ཞེ་བོ་བསྟེན་དགོས་འདུག་བ། རེད་རེད། དམིགས་བསལ་གི་ཞོགས་ཇ་དེ་ཚོ་ལ་ཆུ་མ་རག་ན་ད་ག་འདྲའི་དཀའ་ངལ་མྱང་གི་མ་རེད་བ།
STT_NS0033_0040_298560_to_304247,ཧ་ཧི་ཧ ཆུ། ཆུ་མེད་ན་ཆུ་མེད་ན་ད་ང་ཚོ་ཚང་མ་འཛམ་གླིང་ནང་གནས་ཐུབ་ཀི་མ་རེད། དྲང་མོ་བཤད་ན་རེད་བ། ད་ལྟ་བར་ ,ha hi ha_chu/_chu med na chu med na da nga tsho tshang ma 'dzam gling nang gnas thub ki ma red/_drang mo bshad na red ba/_da lta bar _,https://d38pmlk0v88drf.cloudfront.net/wav16k/STT_NS0033_0040_298560_to_304247.wav,STT_NS,3,100,5.687,wav16k/STT_NS0033_0040_298560_to_304247.wav,ཧ་ཧ།ྲ་རི་ད་ད་ང་ཚོ་ཚང་མ་འཛམ་གླིང་ལ་གནས་ཐུབ་ཀི་མ་རེད། དྲང་པོ་བཤད་རེད་བ། ད་ལྟ
STT_NS0033_0041_304872_to_307825,ཧི་ཧི། ད་ཁྱོད་གཉིས་གཉིས་བཤད། གད་མོ་ག་རེ་བགད་ན་གལ་ཡོད་མ་རེད།  ,hi hi/_da khyod gnyis gnyis bshad/_gad mo ga re bgad na gal yod ma red/__,https://d38pmlk0v88drf.cloudfront.net/wav16k/STT_NS0033_0041_304872_to_307825.wav,STT_NS,3,61,2.953,wav16k/STT_NS0033_0041_304872_to_307825.wav,་། རྒ་ས་རྒྱུག་རྒན་ལག་འགྲད་།
STT_NS0033_0042_310964_to_313157,ཆུ་དེ་བེད་མེད་ལོངས་སྤྱོད་བྱས་རྒྱོ་དེ་ཚོ་བསམ་བློ་ཞིག་འཁོར་སོང་ང་།  ,chu de bed med longs spyod byas rgyo de tsho bsam blo zhig 'khor song nga /__,https://d38pmlk0v88drf.cloudfront.net/wav16k/STT_NS0033_0042_310964_to_313157.wav,STT_NS,3,66,2.193,wav16k/STT_NS0033_0042_310964_to_313157.wav,ཆུ་དེ་བེད་མོད་ལོངས་སྤྱོད་བྱེད་རྒྱོ་དེ་འདྲའི་བསམ་བློ་ཅིག་འཁོར་སོང་བ།
STT_NS0033_0043_313478_to_316887,ཨོ་ཨོ། ཨོ་དེ་ང་རང་ཉིན་གཅིག་ཆུ་ཡ་ཡུད་འཕྲོ་བརླག་བཏང་ཡིན་ད་རེད་བ། ཨོ་དེ་གིས། ག་འདྲའི་རེད་ག་འདྲའི། གཅིག་བཤད་ད་ ,o o/_o de nga rang nyin gcig chu ya yud 'phro brlag btang yin da red ba/_o de gis/_ga 'dra'i red ga 'dra'i/_gcig bshad da _,https://d38pmlk0v88drf.cloudfront.net/wav16k/STT_NS0033_0043_313478_to_316887.wav,STT_NS,3,107,3.409,wav16k/STT_NS0033_0043_313478_to_316887.wav,ཨོ།འོ་དེ་ང་རང་གཉིས་ཅིག་ཆུ་ཡ་ཡུད་འཕྲོ་བརླག་བཏང་ཡིན་ད་རེད་བ། འོ་དེ དེ་འདྲ་ག་དི་ཅིག་བཤད་དང་།
STT_NS0033_0044_322034_to_329163,ཨ་ཕལ་ཆེར་དེ་ཡིན་ས་རེད་ངས་དེ། ད་ང་བཤད་ཐུབ་ས་མ་རེད་ད་ཡོད་བ། ང་བཤད་ན་ངོ་ཚ་ས་རེད། ད་ལྟ་ཡང་ཆུའི་སྐོར་གལ་ཆེན་པོ་ཞེ་བོ་ཁ་ནས་ ,a phal cher de yin sa red ngas de/_da nga bshad thub sa ma red da yod ba/_nga bshad na ngo tsha sa red/_da lta yang chu'i skor gal chen po zhe bo kha nas _,https://d38pmlk0v88drf.cloudfront.net/wav16k/STT_NS0033_0044_322034_to_329163.wav,STT_NS,3,118,7.129,wav16k/STT_NS0033_0044_322034_to_329163.wav,ཨ་ལེ་ཕལ་ཆེར་འདེ་ཡིན་ས་རེད།་དེ། ད་ང་བཤད་ཐུབ་ས་མ་རེད་དེ་ཡོད་བ། ངོ་ཤེས་ནས་ངོ་ཚ་སོང་། ད་ལྟ་ཡང་ཆུ་སྐོར་གལ་ཆེན་པོ་ཞེ་བོ་ཁ་ནས་
STT_NS0033_0045_329163_to_336293,ཁ་རྒྱགས་པ་བཤད་རེད་བ། ད་ཡང་སོ་སོས་ཆུ་ག་རེ་བེད་སྤྱོད་ལོག་པ་བཏང་རྒྱོ་བཤད་ན་ཡང་ཏོག་ཙི་ང་ངོ་ཚ་ས་རེད། མ་རེད་ད། དེ་ཚོ་ག་རེ་ཡོད་རེད་ལབ་ན་ད་དངོས་གནས་ ,kha rgyags pa bshad red ba/_da yang so sos chu ga re bed spyod log pa btang rgyo bshad na yang tog tsi nga ngo tsha sa red/_ma red da/_de tsho ga re yod red lab na da dngos gnas _,https://d38pmlk0v88drf.cloudfront.net/wav16k/STT_NS0033_0045_329163_to_336293.wav,STT_NS,3,141,7.13,wav16k/STT_NS0033_0045_329163_to_336293.wav,ཕར་རྒྱགས་པ་ཆགས་རེད་བ། ད་ཡང་སོ་སོ་ཆུ་ག་རེ་བེད་སྤྱོད་རོག་པ་བཏང་རྒྱོ་བཤད་ན་ཡང་ཏོག་ཙི་ང་ངོ་ཚ་ཡ་ད་ས་རེད། ད་ང་རེད་། སོ་སོ་ག་རེ་རེད་ལབ་ན་ད་དངོས་གནས།
STT_NS0033_0046_336327_to_345304,ང་ཚོ་གིས་ཆུའི་གལ་གནད་དེ་ག་ཚོད་ཡིན་པ་དེ་གལ་ཆེན་པོ་ཡིན་མིན་ཧ་གོ་གི་ཡོད་རེད་ད། ཨུན་ཨུན། ཡིན་ནས་ང་ཚོ་གིས་བེད་མེད་ལོངས་སྤྱོད་བྱེད་ཡ་དེ་ཉི་མ་རྟག་པ་བྱེད་བསྡད་ཡ་དེ་འདྲའི་ད་གེ་མ་རེད་བ། རེད་རེད། མཚམས་རེ་ད་ང་ཚོས་སྣང་མེད་ངང་ནས་ཡིན་ན་རེད་ ,nga tsho gis chu'i gal gnad de ga tshod yin pa de gal chen po yin min ha go gi yod red da/_un un/_yin nas nga tsho gis bed med longs spyod byed ya de nyi ma rtag pa byed bsdad ya de 'dra'i da ge ma red ba/_red red/_mtshams re da nga tshos snang med ngang nas yin na red _,https://d38pmlk0v88drf.cloudfront.net/wav16k/STT_NS0033_0046_336327_to_345304.wav,STT_NS,3,226,8.977,wav16k/STT_NS0033_0046_336327_to_345304.wav,ང་ཚོ་གི་ཆུ་ཡི་གལ་གནད་དེ་ག་ཚོད་ཡིན་པ་དེ་གལ་ཆེན་པོ་ཡིན་མིན་ཧ་གོ་ི་ཡོད་རེད་ད། ཨུན། ཡིན་ནས་ང་ཚོ་གིས་བེད་མེད་ལོངས་སྤྱོད་བྱེད་ཡ་དེ་ཉིན་མ་རྟག་པར་བྱེད་བསྡད་ཡ་དེ་འདྲའ་གེ་མ་རེད་བ། རེད་རེད། མཚམས་རེ་ད་ང་ཚོ་སྣང་མེད་ངང་ནས་ཡིན་ན་རེད།
STT_NS0033_0047_345540_to_347970,ད་ག་རེ་ལབ་དགོས་རེད། ད་སོ་སོ་གིས་ཤེས་ཀི་ཡོད་རེད་ད་ཡིན་ནས་ད ,da ga re lab dgos red/_da so so gis shes ki yod red da yin nas da_,https://d38pmlk0v88drf.cloudfront.net/wav16k/STT_NS0033_0047_345540_to_347970.wav,STT_NS,3,58,2.43,wav16k/STT_NS0033_0047_345540_to_347970.wav,ད་ག་རེ་ལབ་དགོས་རེད། ད་སོ་སོ་གིས་ཤེས་ཀི་ཡོད་རེད་ད། ཡིན་ནས་ད་
STT_NS0033_0058_436902_to_442015,གང་ཤེས་ད། བུ་མོ་དེ་ཚོས་ཞེ་བོ་བཀྲུས་བསྡད་ཀི་རེད་ད། ཨུན། ད་ཚར་རེད། ཁྲུས་ཁང་ད་ག་དུས་ཡིན་ནས་ཁྲུས་ཁང་རྦད་ ,gang shes da/_bu mo de tshos zhe bo bkrus bsdad ki red da/_un/_da tshar red/_khrus khang da ga dus yin nas khrus khang rbad _,https://d38pmlk0v88drf.cloudfront.net/wav16k/STT_NS0033_0058_436902_to_442015.wav,STT_NS,3,101,5.113,wav16k/STT_NS0033_0058_436902_to_442015.wav,ག་རེ་ད། བུ་མོ་དེ་ཚོ་ཞེ་བོ་བཀྲུས་བསྡད་ཡོད་རེད་ད། ད་ཚར་རེད། ཁྲི་ང་ཏ་ད་ག་དུས་ཡིན་ནས་ཁྲི་ང་རྦད
